текст_вопроса,ответ(текст_ответа%признак_правильности_ответа|другие_ответы...)
Столица Франции?;Лондон%false|Париж%true|Берлин%false
Какая планета известна, как "Красная планета"?;Марс%true|Венера%false|Юпитер%false
Кто написал "Ромео и Джульетта"?;Уильям Шекспир%true|Чарльз Диккенс%false|Джейн Остин%false
Какое млекопитающее самое большое на Земле?;Жираф%false|Африканский слон%false|Белый кит%true
Какой известный учёный известен благодаря теории относительности?;Исаак Ньютон%false|Альберт Эйнштейн%true|Галилео Галилей%false
